<!ELEMENT scenario ( CallLengthRepartition | ResponseTimeRepartition | Reference | send | recv | pause | nop | sendCmd | recvCmd | label | timewait)* >
<!ATTLIST scenario name CDATA #IMPLIED >

<!-- BEGIN message commands -->

<!ENTITY % messageCmdCommon '
  start_rtd NMTOKEN #IMPLIED
  rtd NMTOKEN #IMPLIED
  repeat_rtd (true|false) #IMPLIED
  crlf (true|false) #IMPLIED
  next NMTOKEN #IMPLIED
  test NMTOKEN #IMPLIED
  chance NMTOKEN #IMPLIED
  condexec NMTOKEN #IMPLIED
  condexec_inverse NMTOKEN #IMPLIED
  counter NMTOKEN #IMPLIED
  '>

<!ELEMENT send (#PCDATA|action)* >
<!ATTLIST send %messageCmdCommon; >
<!ATTLIST send retrans NMTOKEN #IMPLIED >
<!ATTLIST send lost NMTOKEN #IMPLIED >
<!ATTLIST send start_txn NMTOKEN #IMPLIED >
<!ATTLIST send ack_txn NMTOKEN #IMPLIED >

<!ELEMENT recv ( action? ) >
<!ATTLIST recv %messageCmdCommon; >
<!ATTLIST recv response NMTOKEN #IMPLIED >
<!ATTLIST recv request CDATA #IMPLIED >
<!ATTLIST recv optional (true|false) #IMPLIED >
<!ATTLIST recv ignosesdp (true|false) #IMPLIED >
<!ATTLIST recv rrs (true|false) #IMPLIED >
<!ATTLIST recv auth (true|false) #IMPLIED >
<!ATTLIST recv lost NMTOKEN #IMPLIED >
<!ATTLIST recv timeout NMTOKEN #IMPLIED >
<!ATTLIST recv ontimeout NMTOKEN #IMPLIED >
<!ATTLIST recv regexp_match (true|false) #IMPLIED >
<!ATTLIST recv response_txn NMTOKEN #IMPLIED >

<!ELEMENT pause EMPTY >
<!ATTLIST pause %messageCmdCommon; >
<!ATTLIST pause milliseconds NMTOKEN #IMPLIED >
<!ATTLIST pause variable NMTOKEN #IMPLIED >
<!ATTLIST pause distribution NMTOKEN #IMPLIED >
<!ATTLIST pause sanity_check (true|false) #IMPLIED >

<!ELEMENT nop ( action? ) >
<!ATTLIST nop %messageCmdCommon; >
<!ATTLIST nop display CDATA #IMPLIED >

<!ELEMENT sendCmd ( #PCDATA ) >
<!ATTLIST sendCmd %messageCmdCommon; >
<!ATTLIST sendCmd dest NMTOKEN #IMPLIED >

<!ELEMENT recvCmd ( action? ) >
<!ATTLIST recvCmd %messageCmdCommon; >
<!ATTLIST recvCmd src NMTOKEN #IMPLIED >

<!-- END message commands -->

<!ELEMENT label ( #PCDATA ) >
<!ATTLIST label id NMTOKEN #IMPLIED >

<!ELEMENT ResponseTimeRepartition EMPTY >
<!ATTLIST ResponseTimeRepartition value CDATA #REQUIRED >

<!ELEMENT CallLengthRepartition EMPTY >
<!ATTLIST CallLengthRepartition value CDATA #REQUIRED >

<!ELEMENT action ( add | assign | assignstr | divide | ereg | exec | gettimeofday | insert | jump | log | lookup | multiply | replace | rtp_echo | sample | setdest | strcmp | subtract | test | todouble | urldecode | urlencode | verifyauth | warning )+ >

<!-- BEGIN actions -->

<!ELEMENT ereg EMPTY >
<!ATTLIST ereg assign_to CDATA #REQUIRED >
<!ATTLIST ereg case_indep (true|false) #IMPLIED >
<!ATTLIST ereg check_it (true|false) "false" >
<!ATTLIST ereg check_it_inverse (true|false) "false" >
<!ATTLIST ereg header NMTOKEN #IMPLIED >
<!ATTLIST ereg occurence CDATA #IMPLIED >
<!ATTLIST ereg regexp CDATA #REQUIRED >
<!ATTLIST ereg search_in (msg|hdr) "msg" >
<!ATTLIST ereg start_line (true|false) #IMPLIED >
<!ATTLIST ereg variable CDATA #IMPLIED >


<!ELEMENT log EMPTY >
<!ATTLIST log message CDATA #REQUIRED >

<!ELEMENT warning EMPTY >
<!ATTLIST warning message CDATA #REQUIRED >

<!ELEMENT exec EMPTY >
<!-- one of command or int_cmd must be present -->
<!ATTLIST exec command CDATA #IMPLIED >
<!ATTLIST exec int_cmd (stop_now|stop_gracefully|stop_call) "stop_call" >
<!ATTLIST exec play_pcap CDATA #IMPLIED >
<!ATTLIST exec play_pcap_audio CDATA #IMPLIED >
<!ATTLIST exec rtp_stream CDATA #IMPLIED >
<!ATTLIST exec rtp_echo CDATA #IMPLIED >

<!ELEMENT rtp_echo EMPTY >
<!ATTLIST rtp_echo value CDATA #REQUIRED >

<!ELEMENT strcmp EMPTY >
<!ATTLIST strcmp assign_to CDATA #REQUIRED >
<!ATTLIST strcmp value CDATA #REQUIRED >
<!ATTLIST strcmp variable CDATA #REQUIRED >

<!ELEMENT test EMPTY >
<!ATTLIST test assign_to CDATA #REQUIRED >
<!ATTLIST test compare CDATA #REQUIRED >
<!ATTLIST test value CDATA #REQUIRED >
<!ATTLIST test variable CDATA #REQUIRED >

<!ELEMENT add EMPTY >
<!ATTLIST add assign_to CDATA #REQUIRED >
<!ATTLIST add variable CDATA #REQUIRED >

<!ELEMENT subtract EMPTY >
<!ATTLIST subtract assign_to CDATA #REQUIRED >
<!ATTLIST subtract variable CDATA #REQUIRED >

<!ELEMENT multiply EMPTY >
<!ATTLIST multiply assign_to CDATA #REQUIRED >
<!ATTLIST multiply variable CDATA #REQUIRED >

<!ELEMENT divide EMPTY >
<!ATTLIST divide assign_to CDATA #REQUIRED >
<!ATTLIST divide variable CDATA #REQUIRED >

<!ELEMENT assign EMPTY >
<!ATTLIST assign assign_to CDATA #REQUIRED >
<!ATTLIST assign variable CDATA #REQUIRED >

<!ELEMENT assignstr EMPTY >
<!ATTLIST assignstr assign_to CDATA #REQUIRED >
<!ATTLIST assignstr variable CDATA #REQUIRED >

<!ELEMENT gettimeofday EMPTY >
<!ATTLIST gettimeofday assign_to CDATA #REQUIRED >

<!ELEMENT insert EMPTY >
<!ATTLIST insert file CDATA #REQUIRED >
<!ATTLIST insert value CDATA #REQUIRED >

<!ELEMENT jump EMPTY >
<!ATTLIST jump value CDATA #IMPLIED >
<!ATTLIST jump variable CDATA #IMPLIED >

<!ELEMENT lookup EMPTY >
<!ATTLIST lookup assign_to CDATA #REQUIRED >
<!ATTLIST lookup file CDATA #REQUIRED >
<!ATTLIST lookup key CDATA #REQUIRED >

<!ELEMENT replace EMPTY >
<!ATTLIST replace file CDATA #REQUIRED >
<!ATTLIST replace line CDATA #REQUIRED >
<!ATTLIST replace value CDATA #REQUIRED >

<!ELEMENT sample EMPTY >
<!ATTLIST sample assign_to CDATA #REQUIRED >
<!ATTLIST sample distribution CDATA #REQUIRED >
<!ATTLIST sample mean CDATA #REQUIRED >
<!ATTLIST sample stdev CDATA #REQUIRED >

<!ELEMENT setdest EMPTY >
<!ATTLIST setdest host CDATA #REQUIRED >
<!ATTLIST setdest port CDATA #REQUIRED >
<!ATTLIST setdest protocol CDATA #REQUIRED >

<!ELEMENT todouble EMPTY >
<!ATTLIST todouble assign_to CDATA #REQUIRED >
<!ATTLIST todouble variable CDATA #REQUIRED >

<!ELEMENT urldecode EMPTY >
<!ATTLIST urldecode variable CDATA #REQUIRED >

<!ELEMENT urlencode EMPTY >
<!ATTLIST urlencode variable CDATA #REQUIRED >

<!ELEMENT verifyauth EMPTY >
<!ATTLIST verifyauth assign_to CDATA #REQUIRED >
<!ATTLIST verifyauth username CDATA #REQUIRED >
<!ATTLIST verifyauth password CDATA #REQUIRED >

<!-- END actions -->

<!ELEMENT timewait EMPTY >
<!ATTLIST timewait milliseconds CDATA #REQUIRED >

<!ELEMENT Reference EMPTY >
<!ATTLIST Reference variables CDATA #REQUIRED >
