<?xml version="1.0" encoding="ISO-8859-1" ?>
<!DOCTYPE scenario SYSTEM "sipp.dtd">

<scenario name="INVITE to ConfBridge with SDP in initial INVITE">
  <send retrans="500">
    <![CDATA[

      INVITE sip:conference@[remote_ip]:[remote_port] SIP/2.0
      Via: SIP/2.0/[transport] [local_ip]:[local_port];branch=[branch]
      From: test1 <sip:[service]@[local_ip]:[local_port]>;tag=[call_number]
      To: test <sip:test@[remote_ip]:[remote_port]>
      Call-ID: [call_id]
      CSeq: 1 INVITE
      Contact: <sip:test@[local_ip]:[local_port];transport=[transport]>
      Max-Forwards: 70
      Subject: Test
      User-Agent: Test
      Content-Type: application/sdp
      Content-Length: [len]

      v=0
      o=phoneA 53655765 2353687637 IN IP[local_ip_type] [local_ip]
      s=-
      c=IN IP[media_ip_type] [media_ip]
      t=0 0
      m=audio 6000 RTP/AVP 0
      a=rtpmap:0 PCMU/8000

    ]]>
  </send>

  <recv response="100"
        optional="true">
  </recv>

  <recv response="200" rtd="true">
  </recv>

  <send>
    <![CDATA[

      ACK sip:conference@[remote_ip]:[remote_port] SIP/2.0
      Via: SIP/2.0/[transport] [local_ip]:[local_port];branch=[branch]
      From: test1 <sip:[service]@[local_ip]:[local_port]>;tag=[call_number]
      To: test <sip:test@[remote_ip]:[remote_port]>[peer_tag_param]
      Call-ID: [call_id]
      CSeq: 1 ACK
      Contact: <sip:test@[local_ip]:[local_port];transport=[transport]>
      Max-Forwards: 70
      Subject: Test
      Content-Length: 0

    ]]>
  </send>

  <recv request="INVITE">
    <action>
      <ereg regexp="m=video [0-9]{1,5} RTP/AVP 99+..*"
            search_in="body" check_it="true" assign_to="1"/>
      <test assign_to="1" variable="1" compare="equal" value=""/>
    </action>
  </recv>

  <send retrans="500">
    <![CDATA[

      SIP/2.0 200 OK
      [last_Via:]
      [last_From:]
      [last_To:]
      [last_Call-ID:]
      [last_CSeq:]
      Contact: <sip:test@[local_ip]:[local_port];transport=[transport]>
      Content-Type: application/sdp
      Content-Length: [len]

      v=0
      o=phoneA 53655765 2353687638 IN IP[local_ip_type] [local_ip]
      s=-
      c=IN IP[media_ip_type] [media_ip]
      t=0 0
      m=audio 6000 RTP/AVP 0
      a=rtpmap:0 PCMU/8000
      m=video 6002 RTP/AVP 99
      a=rtpmap:99 H264/90000

    ]]>
  </send>

  <recv request="ACK"
        rtd="true"
        crlf="true">
  </recv>

  <recv request="INVITE">
    <action>
      <ereg regexp="m=video 0 RTP/AVP 99+..*"
            search_in="body" check_it="true" assign_to="2"/>
      <test assign_to="2" variable="2" compare="equal" value=""/>
    </action>
  </recv>

  <send retrans="500">
    <![CDATA[

      SIP/2.0 200 OK
      [last_Via:]
      [last_From:]
      [last_To:]
      [last_Call-ID:]
      [last_CSeq:]
      Contact: <sip:test@[local_ip]:[local_port];transport=[transport]>
      Content-Type: application/sdp
      Content-Length: [len]

      v=0
      o=phoneA 53655765 2353687639 IN IP[local_ip_type] [local_ip]
      s=-
      c=IN IP[media_ip_type] [media_ip]
      t=0 0
      m=audio 6000 RTP/AVP 0
      a=rtpmap:0 PCMU/8000
      m=video 0 RTP/AVP 99

    ]]>
  </send>

  <recv request="ACK"
        rtd="true"
        crlf="true">
  </recv>

  <send retrans="500">
    <![CDATA[

      BYE sip:conference@[remote_ip]:[remote_port] SIP/2.0
      Via: SIP/2.0/[transport] [local_ip]:[local_port];branch=[branch]
      From: test1 <sip:[service]@[local_ip]:[local_port]>;tag=[call_number]
      To: test <sip:test@[remote_ip]:[remote_port]>[peer_tag_param]
      Call-ID: [call_id]
      CSeq: [cseq] BYE
      Contact: <sip:test@[local_ip]:[local_port];transport=[transport]>
      Max-Forwards: 70
      Subject: Test
      Content-Length: 0

    ]]>
  </send>

  <recv response="200">
  </recv>

  <!-- definition of the response time repartition table (unit is ms)   -->
  <ResponseTimeRepartition value="10, 20, 30, 40, 50, 100, 150, 200"/>

  <!-- definition of the call length repartition table (unit is ms)     -->
  <CallLengthRepartition value="10, 50, 100, 500, 1000, 5000, 10000"/>

</scenario>

