<?xml version="1.0" encoding="ISO-8859-1" ?>
<!-- If you have a smart XML editor, using the sipp dtd can be a big help -->
<!DOCTYPE scenario SYSTEM "../../../../../../../contrib/sipp/sipp.dtd">
<scenario name="single_realm_single_digest_options">

	<recv request="OPTIONS">
	</recv>

	<!--
		The nonce and opaque have no meaning other than they're properly formatted.
		We're going to send a single challenge with the "star" realm and "md5"
		digest algorithm.  99.999% of the cases.
	-->
	<send>
    <![CDATA[

      SIP/2.0 401 Authorization Required
      [last_Via:]
      [last_From:]
      [last_To:];tag=[pid]SIPpTag01[call_number]
      [last_Call-ID:]
      [last_CSeq:]
      Contact: <sip:[local_ip]:[local_port];transport=[transport]>
      Content-Length: 0
      WWW-Authenticate: Digest realm="star",nonce="1618496418/76de4d6a2e8750da189999715d6d55b1",opaque="4982d4386a93d85d",algorithm=md5,qop="auth"

    ]]>
	</send>

	<recv request="OPTIONS">
		<action>
			<ereg regexp="Digest .*username=.(.+)..*realm=.(star)."
				search_in="hdr" header="Authorization:"
				assign_to="junk,username,realm"/>
			<!--
				sipp will examine the returned Authentication header and
				validate the username and password.
			-->
			<verifyauth assign_to="authvalid" username="optuser"
				password="optpasswd"/>
		</action>
	</recv>

	<!--
		If authvalid is set, the alidation was successful so skip on
		down to sending an OK.
	-->
	<nop test="authvalid" next="goodauth"/>

	<!--
		We're not testing Asterisk's ability to handle repeated auth failures
		so we just send back a 503 and terminate the test with prejudice
	-->
	<send>
    <![CDATA[

      SIP/2.0 503 Service Unavailable
      [last_Via:]
      [last_From:]
      [last_To:];tag=[pid]SIPpTag01[call_number]
      [last_Call-ID:]
      [last_CSeq:]
      Contact: <sip:[local_ip]:[local_port];transport=[transport]>
      Content-Length: 0

    ]]>
	</send>

	<nop>
		<action>
			<!--
				Terminate the test with prejudice.
				sipp will return a non-zero return code which
				will cause the test to fail.
			-->
			<exec int_cmd="stop_now"/>
		</action>
	</nop>

	<!-- Auth passed so just send back an OK and we're done -->
	<label id="goodauth"/>

	<send>
    <![CDATA[

      SIP/2.0 200 OK
      [last_Via:]
      [last_From:]
      [last_To:];tag=[pid]SIPpTag01[call_number]
      [last_Call-ID:]
      [last_CSeq:]
      Contact: <sip:[local_ip]:[local_port];transport=[transport]>
      Content-Length: [len]

    ]]>
	</send>

	<Reference variables="junk,username,realm"/>
</scenario>
