<?xml version="1.0" encoding="ISO-8859-1" ?>
<!DOCTYPE scenario SYSTEM "sipp.dtd">

<scenario name="UAS 100 responder">

  <recv request="INVITE">

    <action>
      <!-- since we need to send a request to the remote part -->
      <!-- we need to extract the Contact and the From header content -->
      <ereg regexp=".*" search_in="hdr" header="From: " assign_to="remote_from"/>
      <ereg regexp=".*" search_in="hdr" header="To: " assign_to="remote_to"/>
      <!-- assign the content of the Contaact SIP URI to the remote_contact var -->
      <!-- first var of assign_to contains the whole match -->
      <ereg regexp="sip:(.*)>.*" search_in="hdr" header="Contact" assign_to="trash,remote_contact"/>
    </action>

  </recv>

  <!-- since SIPp complains about not used variable reference the trach var -->
  <Reference variables="trash"/>

  <send>
    <![CDATA[

      SIP/2.0 100 Trying
      [last_Via:]
      [last_From:]
      [last_To:];tag=[call_number]
      [last_Call-ID:]
      [last_CSeq:]
      Contact: <sip:[local_ip]:[local_port];transport=[transport]>
      Content-Length: 0

    ]]>
  </send>

  <send retrans="500">
    <![CDATA[

      SIP/2.0 200 OK
      [last_Via:]
      [last_From:]
      [last_To:];tag=[call_number]
      [last_Call-ID:]
      [last_CSeq:]
      Contact: <sip:[local_ip]:[local_port];transport=[transport]>
      Content-Type: application/sdp
      Content-Length: [len]

      v=0
      o=user1 53655765 2353687637 IN IP[local_ip_type] [local_ip]
      s=-
      c=IN IP[media_ip_type] [media_ip]
      t=0 0
      m=audio [media_port] RTP/AVP 0
      a=rtpmap:0 PCMU/8000

    ]]>
  </send>

  <recv request="ACK"
        crlf="true">
  </recv>

  <!-- Send audio -->
  <nop>
    <action>
      <exec rtp_stream="lib/python/asterisk/audio.ulaw,3,0"/>
    </action>
  </nop>

  <label id="waitagain"/>
  <recv request="INVITE" timeout="5000" ontimeout="sendBYE"/>
  <send>
    <![CDATA[

      SIP/2.0 200 OK
      [last_Via:]
      [last_From:]
      [last_To]
      [last_Call-ID:]
      [last_CSeq:]
      Contact: <sip:alice@[local_ip]:[local_port]>
      Content-Length: [len]

      v=0
      o=user1 53655765 2353687637 IN IP[local_ip_type] [local_ip]
      s=-
      c=IN IP[media_ip_type] [media_ip]
      t=0 0
      m=audio [media_port] RTP/AVP 0
      a=rtpmap:0 PCMU/8000

    ]]>
  </send>
  <recv request="ACK" next="waitagain"/>

  <label id="sendBYE"/>
  <send retrans="500">
    <![CDATA[

      BYE sip:[$remote_contact] SIP/2.0
      [last_Via:]
      From: [$remote_to];tag=[call_number]
      To: [$remote_from]
      [last_Call-ID:]
      CSeq: [cseq] BYE
      Contact: <sip:[local_ip]:[local_port];transport=[transport]>
      Max-Forwards: 70
      Content-Length: 0

    ]]>
  </send>

  <recv response="200"/>

  <!-- Keep the call open for a while in case the 200 is lost to be     -->
  <!-- able to retransmit it if we receive the BYE again.               -->
  <pause milliseconds="500"/>

  <label id="scenario_end"/>

  <!-- definition of the response time repartition table (unit is ms)   -->
  <ResponseTimeRepartition value="10, 20, 30, 40, 50, 100, 150, 200"/>

  <!-- definition of the call length repartition table (unit is ms)     -->
  <CallLengthRepartition value="10, 50, 100, 500, 1000, 5000, 10000"/>

</scenario>
