<?xml version="1.0" encoding="ISO-8859-1" ?>
<!DOCTYPE scenario SYSTEM "sipp.dtd">

<scenario name="INVITE to echo with SDP in initial INVITE">
  <send retrans="500">
    <![CDATA[

      INVITE sip:test@[remote_ip]:[remote_port] SIP/2.0
      Via: SIP/2.0/[transport] [local_ip]:[local_port];branch=[branch]
      From: test[call_number] <sip:[service]@[local_ip]:[local_port]>;tag=[call_number]
      To: test <sip:test@[remote_ip]:[remote_port]>
      Call-ID: [call_id]
      CSeq: 1 INVITE
      Contact: <sip:test@[local_ip]:[local_port];transport=[transport]>
      Max-Forwards: 70
      Subject: Test
      User-Agent: Test
      Content-Type: application/sdp
      Content-Length: [len]

      v=0
      o=phoneA 53655765 2353687637 IN IP[local_ip_type] [local_ip]
      s=-
      c=IN IP[media_ip_type] [media_ip]
      t=0 0
      m=audio 6000 RTP/AVP 0
      a=rtpmap:0 PCMU/8000

    ]]>
  </send>

  <recv response="100"
        optional="true">
  </recv>

  <recv response="488"
        optional="true"
        next="1"
        rtd="true">
        <action>
          <ereg regexp="test[4-6]" search_in="hdr" header="From: " assign_to="4"/>
          <test assign_to="4" variable="4" compare="equal" value=""/>
        </action>
  </recv>

  <recv response="200" rtd="true">
      <action>
      <ereg regexp="m=audio 1000[0-4] RTP/AVP 0+..*"
            search_in="body" check_it="true" assign_to="5"/>
      <test assign_to="5" variable="5" compare="equal" value=""/>
    </action>
  </recv>

  <send>
    <![CDATA[

      ACK sip:test@[remote_ip]:[remote_port] SIP/2.0
      Via: SIP/2.0/[transport] [local_ip]:[local_port];branch=[branch]
      From: test[call_number] <sip:[service]@[local_ip]:[local_port]>;tag=[call_number]
      To: test <sip:test@[remote_ip]:[remote_port]>[peer_tag_param]
      Call-ID: [call_id]
      CSeq: 1 ACK
      Contact: <sip:test@[local_ip]:[local_port];transport=[transport]>
      Max-Forwards: 70
      Subject: Test
      Content-Length: 0

    ]]>
  </send>

  <recv request="BYE">
  </recv>

  <send next="2">
    <![CDATA[

      SIP/2.0 200 OK
      [last_Via:]
      [last_From:]
      [last_To:]
      [last_Call-ID:]
      [last_CSeq:]
      Contact: <sip:[local_ip]:[local_port];transport=[transport]>
      Content-Length: 0

    ]]>
  </send>

  <label id="1"/>

  <send next="2">
    <![CDATA[

      ACK sip:test@[remote_ip]:[remote_port] SIP/2.0
      Via: SIP/2.0/[transport] [local_ip]:[local_port];branch=[branch]
      From: test[call_number] <sip:[service]@[local_ip]:[local_port]>;tag=[call_number]
      To: test <sip:test@[remote_ip]:[remote_port]>[peer_tag_param]
      Call-ID: [call_id]
      CSeq: 1 ACK
      Contact: <sip:test@[local_ip]:[local_port];transport=[transport]>
      Max-Forwards: 70
      Subject: Test
      Content-Length: 0

    ]]>
  </send>

  <label id="2"/>

  <!-- definition of the response time repartition table (unit is ms)   -->
  <ResponseTimeRepartition value="10, 20, 30, 40, 50, 100, 150, 200"/>

  <!-- definition of the call length repartition table (unit is ms)     -->
  <CallLengthRepartition value="10, 50, 100, 500, 1000, 5000, 10000"/>

</scenario>

