<?xml version="1.0" encoding="ISO-8859-1" ?>
<!DOCTYPE scenario SYSTEM "sipp.dtd">

<scenario name="INVITE with Identity Header">
  <send retrans="500">
    <![CDATA[

      INVITE sip:test@[remote_ip]:[remote_port] SIP/2.0
      Via: SIP/2.0/[transport] [local_ip]:[local_port];branch=[branch]
      From: test1 <sip:[service]@[local_ip]:[local_port]>;tag=[call_number]
      To: test <sip:test@[remote_ip]:[remote_port]>
      Call-ID: 1234567
      CSeq: 1 INVITE
      Contact: <sip:test@[local_ip]:[local_port];transport=[transport]>
      Max-Forwards: 70
      Identity: eyJhbGciOiJFUzI1NiIsInBwdCI6InNoYWtlbiIsInR5cCI6InBhc3Nwb3J0IiwieDV1IjoiaHR0cDovLzEyNy4wLjAuMTo4MDg4L3B1YmxpY194NTA5X2NlcnQucGVtIn0=.eyJvcmlnIjp7InRuIjoiMTIzNDU2NyJ9LCJhdHRlc3QiOiJDIiwib3JpZ2lkIjoidGVzdHN1aXRlIiwiaWF0IjoxNjE4ODY0NzU4fQ==.MEYCIQDpKNbtqxh04gti5E6FNVaE+8kItvp3yBzegZkCn6/iFgIhALOUhJJjNTyckW7JUwSurfY+3rV3ZwOLi5P8ZawgVCNq;info=<http://127.0.0.1:8088/public_x509_cert.pem>alg=ES256;ppt=shaken
      Subject: Test
      User-Agent: Test
      Content-Type: application/sdp
      Content-Length: [len]

      v=0
      o=phoneA 53655765 2353687637 IN IP[local_ip_type] [local_ip]
      s=-
      c=IN IP[media_ip_type] [media_ip]
      t=0 0
      m=audio 6000 RTP/AVP 0
      a=rtpmap:0 PCMU/8000

    ]]>
  </send>

  <recv response="100" optional="true"/>

  <recv response="200" rtd="true"/>

  <send>
    <![CDATA[

      ACK sip:test@[remote_ip]:[remote_port] SIP/2.0
      Via: SIP/2.0/[transport] [local_ip]:[local_port];branch=[branch]
      From: test1 <sip:[service]@[local_ip]:[local_port]>;tag=[call_number]
      To: test <sip:test@[remote_ip]:[remote_port]>[peer_tag_param]
      Call-ID: [call_id]
      CSeq: 1 ACK
      Contact: <sip:test@[local_ip]:[local_port];transport=[transport]>
      Max-Forwards: 70
      Subject: Test
      Content-Length: 0

    ]]>
  </send>

  <recv request="BYE"/>

  <send>
    <![CDATA[

      SIP/2.0 200 OK
      [last_Via:]
      [last_From:]
      [last_To:]
      [last_Call-ID:]
      [last_CSeq:]
      Contact: <sip:test@[local_ip]:[local_port];transport=[transport]>
      Content-Length: 0

    ]]>
  </send>

</scenario>
