<?xml version="1.0" encoding="ISO-8859-1" ?>
<!DOCTYPE scenario SYSTEM "sipp.dtd">

<scenario name="T38 REINVITE">

<recv request="INVITE" crlf="true"  rrs="true">

<action>
  <ereg regexp="[[:punct:]](.*)[[:punct:]]" search_in="hdr" header="Contact:" check_it="true" assign_to="6,1" />
  <ereg regexp=".*" search_in="hdr" header="From:" check_it="true" assign_to="2" />
  <ereg regexp=".*" search_in="hdr" header="To:" check_it="true" assign_to="3" />
  <log message="Log to avoid the problem of not using $3 [$3]"/>
  <log message="Log to avoid the problem of not using $1 [$1]"/>
  <log message="Log to avoid the problem of not using $2 [$2]"/>
  <log message="Log to avoid the problem of not using $6 [$6]"/>
</action>
</recv>


<send>
<![CDATA[

SIP/2.0 100 Trying
[last_Via:]
[last_Call-ID:]
[last_From:]
[last_To:]
[last_CSeq:]
Content-Length: 0

]]>
</send>

<send retrans="500">
<![CDATA[

SIP/2.0 200 OK
[last_Via:]
[last_Call-ID:]
[last_From:]
[last_To:];tag=[call_number]
[last_CSeq:]
[last_Record-Route]
Contact: <sip:bansallaptop@[local_ip]:[local_port];user=phone>
Content-Type: application/sdp
Content-Length: [len]

v=0
o=HuaweiSoftX3000 6644052 6644052 IN IP[local_ip_type] [local_ip]
s=Sip Call
c=IN IP[media_ip_type] [media_ip]
t=0 0
m=audio 8000 RTP/AVP 0 100 101
a=rtpmap:0 PCMU/8000
a=rtpmap:100 NSE/8000
a=rtpmap:101 telephone-event/101

]]>
</send>

<recv request="ACK"
      rtd="true"
      crlf="true">
</recv>

<!-- REINVITE sequence -->

<pause milliseconds="2000"/>

<send retrans="500">
<![CDATA[

INVITE [$1] SIP/2.0
Via: SIP/2.0/[transport] [local_ip]:[local_port];branch=[branch]
[last_Call-ID:]
From: [$3];tag=1
To: [$2]
CSeq: 1 INVITE
Contact: <sip:[local_ip]:[local_port]>
Max-Forwards: 70
Content-Type: application/sdp
[routes]
Allow-Events: telephone-event
Content-Length: [len] 

v=0
o=CiscoSystemsSIP-GW-UserAgent 9624 5280 IN IP4 [local_ip]
s=Asterisk PBX 1.6.2.0
c=IN IP[local_ip_type] [local_ip]
t=0 0
m=image 4389 udptl t38
a=T38FaxVersion:0
a=T38MaxBitRate:14400
a=T38FaxRateManagement:transferredTCF
a=T38FaxMaxDatagram:1400
a=T38FaxUdpEC:t38UDPRedundancy

]]>
</send>

<recv response="100" optional="true">
</recv>
  
<recv response="488" rrs="true">
</recv>

<send>
<![CDATA[

ACK [$1] SIP/2.0
Via: SIP/2.0/[transport] [local_ip]:[local_port];branch=[branch]
[last_Call-ID:]
[last_From]
[last_To]
CSeq: 1 ACK
Max-Forwards: 70
[routes]
Content-Length: 0


]]>
</send>

<pause milliseconds="2000"/>

<send retrans="500">
<![CDATA[

INVITE [$1] SIP/2.0
Via: SIP/2.0/[transport] [local_ip]:[local_port];branch=[branch]
[last_Call-ID:]
From: [$3];tag=1
To: [$2]
CSeq: 2 INVITE
Contact: <sip:[local_ip]:[local_port]>
Max-Forwards: 70
Content-Type: application/sdp
[routes]
Allow-Events: telephone-event
Content-Length: [len] 

v=0
o=HuaweiSoftX3000 6644052 6644052 IN IP[local_ip_type] [local_ip]
s=Sip Call
c=IN IP[media_ip_type] [media_ip]
t=0 0
m=audio 8000 RTP/AVP 0 100 101
a=rtpmap:0 PCMU/8000
a=rtpmap:100 NSE/8000
a=rtpmap:101 telephone-event/101


]]>
</send>

<recv response="100" optional="true">
</recv>
  
<recv response="200" rrs="true">
</recv>

<send>
<![CDATA[

ACK [$1] SIP/2.0
Via: SIP/2.0/[transport] [local_ip]:[local_port];branch=[branch]
[last_Call-ID:]
[last_From]
[last_To]
CSeq: 2 ACK
Max-Forwards: 70
[routes]
Content-Length: 0


]]>
</send>

<!-- Play a pre-recorded PCAP file (RTP stream)                       -->
<nop>
    <action>
      <exec play_pcap_audio="./tests/fax/pjsip/t38_enabled_two_reinvite_on_b_leg/sipp/CUSTOMER_G711U.pcap"/>
    </action>
</nop>


<recv request="BYE">
</recv>

<send>
<![CDATA[

SIP/2.0 200 OK
[last_Via:]
[last_From:]
[last_To:]
[last_Call-ID:]
[last_CSeq:]
Contact: <sip:[local_ip]:[local_port];transport=[transport]>
Content-Length: 0

]]>
</send>

<!-- Keep the call open for a while in case the 200 is lost to be     -->
<!-- able to retransmit it if we receive the BYE again.               -->
<pause milliseconds="4000"/>


<!-- definition of the response time repartition table (unit is ms)   -->
<ResponseTimeRepartition value="10, 20, 30, 40, 50, 100, 150, 200"/>

<!-- definition of the call length repartition table (unit is ms)     -->
<CallLengthRepartition value="10, 50, 100, 500, 1000, 5000, 10000"/>

</scenario>

