<?xml version="1.0" encoding="ISO-8859-1" ?>
<!DOCTYPE scenario SYSTEM "sipp.dtd">

<scenario name="INVITE Anon">
  <send retrans="500">
    <![CDATA[

      INVITE sip:echo@[remote_ip]:[remote_port] SIP/2.0
      Via: SIP/2.0/[transport] [local_ip]:[local_port];branch=[branch]
      From: test1 <sip:[service]@[local_ip]:[local_port]>;tag=[call_number]
      To: test <sip:test@[remote_ip]:[remote_port]>
      Call-ID: [call_id]
      CSeq: 1 INVITE
      Contact: <sip:test@[local_ip]:[local_port];transport=[transport]>
      Max-Forwards: 70
      Subject: Test
      User-Agent: Test
      Content-Type: application/sdp
      Content-Length: [len]

      v=0
      o=phoneA 53655765 2353687637 IN IP[local_ip_type] [local_ip]
      s=-
      c=IN IP[media_ip_type] [media_ip]
      t=0 0
      m=audio 6000 RTP/AVP 0
      a=rtpmap:0 PCMU/8000

    ]]>
  </send>

  <recv response="100" optional="true" />

  <recv response="200" rtd="true" />

  <send>
    <![CDATA[

      ACK sip:echo@[remote_ip]:[remote_port] SIP/2.0
      Via: SIP/2.0/[transport] [local_ip]:[local_port];branch=[branch]
      From: test1 <sip:[service]@[local_ip]:[local_port]>;tag=[call_number]
      To: test <sip:test@[remote_ip]:[remote_port]>[peer_tag_param]
      Call-ID: [call_id]
      CSeq: 1 ACK
      Contact: <sip:test@[local_ip]:[local_port];transport=[transport]>
      Max-Forwards: 70
      Subject: Test
      Content-Length: 0

    ]]>
  </send>

  <send retrans="500">
    <![CDATA[

      BYE sip:echo@[remote_ip]:[remote_port] SIP/2.0
      Via: SIP/2.0/[transport] [local_ip]:[local_port];branch=[branch]
      From: test1 <sip:[service]@[local_ip]:[local_port]>;tag=[call_number]
      To: test <sip:test@[remote_ip]:[remote_port]>[peer_tag_param]
      Call-ID: [call_id]
      CSeq: 2 BYE
      Contact: <sip:test@[local_ip]:[local_port];transport=[transport]>
      Max-Forwards: 70
      Subject: Test
      Content-Length: 0

    ]]>
  </send>

  <recv response="200" crlf="true" />

</scenario>
