<?xml version="1.0" encoding="ISO-8859-1" ?>
<!DOCTYPE scenario SYSTEM "sipp.dtd">

<scenario name="PUBLISH">
  <recv request="PUBLISH" crlf="true">
    <action>
      <ereg regexp="&lt;\?xml version=\"1.0\" encoding=\"UTF-8\"\?&gt;
&lt;presence&gt;
 &lt;presentity uri=\"sip:presence@127.0.0.1:5061;method=SUBSCRIBE\" /&gt;
 &lt;atom atomid=(.*?) id=\"presence\"&gt;
  &lt;address uri=\"sip:presence@127.0.0.1:5061;user=ip\" priority=\"0.80000\"&gt;
   &lt;status status=\"open\" /&gt;
   &lt;msnsubstatus substatus=\"online\" /&gt;
  &lt;/address&gt;
 &lt;/atom&gt;
&lt;/presence&gt;" check_it="true" search_in="body" assign_to="presence1" />
    </action>
  </recv>

  <Reference variables="presence1" />

  <send>
    <![CDATA[

      SIP/2.0 200 OK
      [last_Via:]
      [last_From:]
      [last_To:]
      [last_Call-ID:]
      [last_CSeq:]
      Contact: <sip:[local_ip]:[local_port];transport=[transport]>
      Content-Length: 0

    ]]>
  </send>

  <recv request="PUBLISH" crlf="true">
    <action>
      <ereg regexp="&lt;\?xml version=\"1.0\" encoding=\"UTF-8\"\?&gt;
&lt;presence&gt;
 &lt;presentity uri=\"sip:presence@127.0.0.1:5061;method=SUBSCRIBE\" /&gt;
 &lt;atom atomid=(.*?) id=\"presence\"&gt;
  &lt;address uri=\"sip:presence@127.0.0.1:5061;user=ip\" priority=\"0.80000\"&gt;
   &lt;status status=\"inuse\" /&gt;
   &lt;msnsubstatus substatus=\"onthephone\" /&gt;
  &lt;/address&gt;
 &lt;/atom&gt;
&lt;/presence&gt;" check_it="true" search_in="body" assign_to="presence2" />
    </action>
  </recv>

  <Reference variables="presence2" />

  <send>
    <![CDATA[

      SIP/2.0 200 OK
      [last_Via:]
      [last_From:]
      [last_To:]
      [last_Call-ID:]
      [last_CSeq:]
      Contact: <sip:[local_ip]:[local_port];transport=[transport]>
      Content-Length: 0

    ]]>
  </send>

  <recv request="PUBLISH" crlf="true">
    <action>
      <ereg regexp="&lt;\?xml version=\"1.0\" encoding=\"UTF-8\"\?&gt;
&lt;presence&gt;
 &lt;presentity uri=\"sip:presence@127.0.0.1:5061;method=SUBSCRIBE\" /&gt;
 &lt;atom atomid=(.*?) id=\"presence\"&gt;
  &lt;address uri=\"sip:presence@127.0.0.1:5061;user=ip\" priority=\"0.80000\"&gt;
   &lt;status status=\"inuse\" /&gt;
   &lt;msnsubstatus substatus=\"onthephone\" /&gt;
  &lt;/address&gt;
 &lt;/atom&gt;
&lt;/presence&gt;" check_it="true" search_in="body" assign_to="presence3" />
    </action>
  </recv>

  <Reference variables="presence3" />

  <send>
    <![CDATA[

      SIP/2.0 200 OK
      [last_Via:]
      [last_From:]
      [last_To:]
      [last_Call-ID:]
      [last_CSeq:]
      Contact: <sip:[local_ip]:[local_port];transport=[transport]>
      Content-Length: 0

    ]]>
  </send>

  <recv request="PUBLISH" crlf="true">
    <action>
      <ereg regexp="&lt;\?xml version=\"1.0\" encoding=\"UTF-8\"\?&gt;
&lt;presence&gt;
 &lt;presentity uri=\"sip:presence@127.0.0.1:5061;method=SUBSCRIBE\" /&gt;
 &lt;atom atomid=(.*?) id=\"presence\"&gt;
  &lt;address uri=\"sip:presence@127.0.0.1:5061;user=ip\" priority=\"0.80000\"&gt;
   &lt;status status=\"inuse\" /&gt;
   &lt;msnsubstatus substatus=\"onthephone\" /&gt;
  &lt;/address&gt;
 &lt;/atom&gt;
&lt;/presence&gt;" check_it="true" search_in="body" assign_to="presence4" />
    </action>
  </recv>

  <Reference variables="presence4" />

  <send>
    <![CDATA[

      SIP/2.0 200 OK
      [last_Via:]
      [last_From:]
      [last_To:]
      [last_Call-ID:]
      [last_CSeq:]
      Contact: <sip:[local_ip]:[local_port];transport=[transport]>
      Content-Length: 0

    ]]>
  </send>

  <recv request="PUBLISH" crlf="true">
    <action>
      <ereg regexp="&lt;\?xml version=\"1.0\" encoding=\"UTF-8\"\?&gt;
&lt;presence&gt;
 &lt;presentity uri=\"sip:presence@127.0.0.1:5061;method=SUBSCRIBE\" /&gt;
 &lt;atom atomid=(.*?) id=\"presence\"&gt;
  &lt;address uri=\"sip:presence@127.0.0.1:5061;user=ip\" priority=\"0.80000\"&gt;
   &lt;status status=\"open\" /&gt;
   &lt;msnsubstatus substatus=\"online\" /&gt;
  &lt;/address&gt;
 &lt;/atom&gt;
&lt;/presence&gt;" check_it="true" search_in="body" assign_to="presence5" />
    </action>
  </recv>

  <Reference variables="presence5" />

</scenario>
