<?xml version="1.0" encoding="ISO-8859-1" ?>
<!DOCTYPE scenario SYSTEM "sipp.dtd">

<scenario name="PUBLISH">
  <recv request="PUBLISH" crlf="true">
    <action>
      <ereg regexp="&lt;\?xml version=\"1.0\" encoding=\"UTF-8\"\?&gt;
&lt;dialog-info xmlns=\"urn:ietf:params:xml:ns:dialog-info\" version=\"0\" state=\"full\" entity=\"sip:presence@127.0.0.1:5061\"&gt;
 &lt;dialog id=\"presence\"&gt;
  &lt;state&gt;terminated&lt;/state&gt;
 &lt;/dialog&gt;
&lt;/dialog-info&gt;" check_it="true" search_in="body" assign_to="presence1" />
    </action>
  </recv>

  <Reference variables="presence1" />

  <send>
    <![CDATA[

      SIP/2.0 200 OK
      [last_Via:]
      [last_From:]
      [last_To:]
      [last_Call-ID:]
      [last_CSeq:]
      Contact: <sip:[local_ip]:[local_port];transport=[transport]>
      Content-Length: 0

    ]]>
  </send>

  <recv request="PUBLISH" crlf="true">
    <action>
      <ereg regexp="&lt;\?xml version=\"1.0\" encoding=\"UTF-8\"\?&gt;
&lt;dialog-info xmlns=\"urn:ietf:params:xml:ns:dialog-info\" version=\"1\" state=\"full\" entity=\"sip:presence@127.0.0.1:5061\"&gt;
 &lt;dialog id=\"presence\" direction=\"recipient\"&gt;
  &lt;state&gt;early&lt;/state&gt;
 &lt;/dialog&gt;
&lt;/dialog-info&gt;" check_it="true" search_in="body" assign_to="presence2" />
    </action>
  </recv>

  <Reference variables="presence2" />

  <send>
    <![CDATA[

      SIP/2.0 200 OK
      [last_Via:]
      [last_From:]
      [last_To:]
      [last_Call-ID:]
      [last_CSeq:]
      Contact: <sip:[local_ip]:[local_port];transport=[transport]>
      Content-Length: 0

    ]]>
  </send>

  <recv request="PUBLISH" crlf="true">
    <action>
      <ereg regexp="&lt;\?xml version=\"1.0\" encoding=\"UTF-8\"\?&gt;
&lt;dialog-info xmlns=\"urn:ietf:params:xml:ns:dialog-info\" version=\"2\" state=\"full\" entity=\"sip:presence@127.0.0.1:5061\"&gt;
 &lt;dialog id=\"presence\"&gt;
  &lt;state&gt;confirmed&lt;/state&gt;
 &lt;/dialog&gt;
&lt;/dialog-info&gt;" check_it="true" search_in="body" assign_to="presence3" />
    </action>
  </recv>

  <Reference variables="presence3" />

  <send>
    <![CDATA[

      SIP/2.0 200 OK
      [last_Via:]
      [last_From:]
      [last_To:]
      [last_Call-ID:]
      [last_CSeq:]
      Contact: <sip:[local_ip]:[local_port];transport=[transport]>
      Content-Length: 0

    ]]>
  </send>

  <recv request="PUBLISH" crlf="true">
    <action>
      <ereg regexp="&lt;\?xml version=\"1.0\" encoding=\"UTF-8\"\?&gt;
&lt;dialog-info xmlns=\"urn:ietf:params:xml:ns:dialog-info\" version=\"3\" state=\"full\" entity=\"sip:presence@127.0.0.1:5061\"&gt;
 &lt;dialog id=\"presence\"&gt;
  &lt;state&gt;confirmed&lt;/state&gt;
  &lt;local&gt;
   &lt;target uri=\"sip:presence@127.0.0.1:5061\"&gt;
    &lt;param pname=\"\+sip.rendering\" pvalue=\"no\" /&gt;
   &lt;/target&gt;
  &lt;/local&gt;
 &lt;/dialog&gt;
&lt;/dialog-info&gt;" check_it="true" search_in="body" assign_to="presence4" />
    </action>
  </recv>

  <Reference variables="presence4" />

  <send>
    <![CDATA[

      SIP/2.0 200 OK
      [last_Via:]
      [last_From:]
      [last_To:]
      [last_Call-ID:]
      [last_CSeq:]
      Contact: <sip:[local_ip]:[local_port];transport=[transport]>
      Content-Length: 0

    ]]>
  </send>

  <recv request="PUBLISH" crlf="true">
    <action>
      <ereg regexp="&lt;\?xml version=\"1.0\" encoding=\"UTF-8\"\?&gt;
&lt;dialog-info xmlns=\"urn:ietf:params:xml:ns:dialog-info\" version=\"4\" state=\"full\" entity=\"sip:presence@127.0.0.1:5061\"&gt;
 &lt;dialog id=\"presence\"&gt;
  &lt;state&gt;terminated&lt;/state&gt;
 &lt;/dialog&gt;
&lt;/dialog-info&gt;" check_it="true" search_in="body" assign_to="presence5" />
    </action>
  </recv>

  <Reference variables="presence5" />

  <send>
    <![CDATA[

      SIP/2.0 200 OK
      [last_Via:]
      [last_From:]
      [last_To:]
      [last_Call-ID:]
      [last_CSeq:]
      Contact: <sip:[local_ip]:[local_port];transport=[transport]>
      Content-Length: 0

    ]]>
  </send>

</scenario>
