<?xml version="1.0" encoding="ISO-8859-1" ?>
<!DOCTYPE scenario SYSTEM "sipp.dtd">

<scenario name="T38 REINVITE">

<recv request="INVITE" crlf="true"  rrs="true">

<action>
  <ereg regexp="[[:punct:]](.*)[[:punct:]]" search_in="hdr" header="Contact:" check_it="true" assign_to="6,1" />
  <ereg regexp=".*" search_in="hdr" header="From:" check_it="true" assign_to="2" />
  <ereg regexp=".*" search_in="hdr" header="To:" check_it="true" assign_to="3" />
  <log message="Log to avoid the problem of not using $3 [$3]"/>
  <log message="Log to avoid the problem of not using $1 [$1]"/>
  <log message="Log to avoid the problem of not using $2 [$2]"/>
  <log message="Log to avoid the problem of not using $6 [$6]"/>
</action>
</recv>


<send>
<![CDATA[

SIP/2.0 100 Trying
[last_Via:]
[last_Call-ID:]
[last_From:]
[last_To:]
[last_CSeq:]
Content-Length: 0

]]>
</send>

<send retrans="500">
<![CDATA[

SIP/2.0 200 OK
[last_Via:]
[last_Call-ID:]
[last_From:]
[last_To:];tag=[call_number]
[last_CSeq:]
[last_Record-Route]
Contact: <sip:bansallaptop@[local_ip]:[local_port];user=phone>
Content-Type: application/sdp
Content-Length: [len]

v=0
o=HuaweiSoftX3000 6644052 6644052 IN IP[local_ip_type] [local_ip]
s=Sip Call
c=IN IP[media_ip_type] [media_ip]
t=0 0
m=audio 8000 RTP/AVP 0 100 101
a=rtpmap:0 PCMU/8000
a=rtpmap:100 NSE/8000
a=rtpmap:101 telephone-event/101

]]>
</send>

<recv request="ACK"
      rtd="true"
      crlf="true">
</recv>

<pause milliseconds="500" />

<!-- play the pcap now as packets will get through before the reinvite
     After the reinvite B leg sending fails because sipp changes destination port to suit the reinvite port which is incorrect
     for the original call that was negotiated
     After the reinvite the packets get destination port unreachable.
     All the A leg packets get through because asterisk behave correctly
     -->
<nop>
  <action>
    <exec play_pcap_audio="./tests/fax/pjsip/t38_enabled_two_reinvite_on_a_leg/sipp/CUSTOMER_G711U.pcap"/>
  </action>
</nop>

<recv request="INVITE" crlf="true"  rrs="true">
</recv>

<pause milliseconds="200" />

<send retrans="500">
<![CDATA[

SIP/2.0 488 Not Acceptable Here
[last_Via:]
[last_To:]
[last_From:]
[last_Call-ID:]
[last_Cseq:] 
Contact: <sip:390415094280@[local_ip]:[local_port]>
User-Agent: Cisco-SIPGateway/IOS-12.x
Max-Forwards: 69
Content-Length: 0

]]>
</send>

<recv request="ACK"
      rtd="true"
      crlf="true">
</recv>

<recv request="BYE">
</recv>

<send>
<![CDATA[

SIP/2.0 200 OK
[last_Via:]
[last_From:]
[last_To:]
[last_Call-ID:]
[last_CSeq:]
Contact: <sip:[local_ip]:[local_port];transport=[transport]>
Content-Length: 0

    ]]>
</send>

<!-- Keep the call open for a while in case the 200 is lost to be     -->
<!-- able to retransmit it if we receive the BYE again.               -->
<pause milliseconds="4000"/>


<!-- definition of the response time repartition table (unit is ms)   -->
<ResponseTimeRepartition value="10, 20, 30, 40, 50, 100, 150, 200"/>

<!-- definition of the call length repartition table (unit is ms)     -->
<CallLengthRepartition value="10, 50, 100, 500, 1000, 5000, 10000"/>

</scenario>
