<?xml version="1.0" encoding="ISO-8859-1" ?>
<!DOCTYPE scenario SYSTEM "sipp.dtd">

<scenario name="UAS 100 responder">

  <recv request="INVITE" crlf="true">
      <!-- Save the from tag. We'll need it when we send our BYE -->
      <action>
          <ereg regexp="(;tag=.*)"
              header="From:"
              search_in="hdr"
              check_it="true"
              assign_to="remote_tag"/>
	  </action>
  </recv>

  <send>
    <![CDATA[

      SIP/2.0 100 Trying
      [last_Via:]
      [last_From:]
      [last_To:];tag=[call_number]
      [last_Call-ID:]
      [last_CSeq:]
      Contact: <sip:[local_ip]:[local_port];transport=[transport]>
      Content-Length: 0

    ]]>
  </send>

  <send retrans="500">
    <![CDATA[

      SIP/2.0 200 OK
      [last_Via:]
      [last_From:]
      [last_To:];tag=[call_number]
      [last_Call-ID:]
      [last_CSeq:]
      Contact: <sip:[local_ip]:[local_port];transport=[transport]>
      Content-Type: application/sdp
      Content-Length: [len]

      v=0
      o=user1 53655765 2353687637 IN IP[local_ip_type] [local_ip]
      s=-
      c=IN IP[media_ip_type] [media_ip]
      t=0 0
      m=audio [media_port] RTP/AVP 0
      a=rtpmap:0 PCMU/8000

    ]]>
  </send>

  <recv request="ACK"
        crlf="true">
  </recv>

  <pause milliseconds="1000" />

  <send retrans="500">
    <![CDATA[

      BYE sip:[service]@[remote_ip]:[remote_port] SIP/2.0
      [last_Via:]
      [last_From:]
      To: [$remote_tag]
      [last_Call-ID:]
      CSeq: 2 BYE
      Contact: <sip:[local_ip]:[local_port];transport=[transport]>
      Max-Forwards: 70
      Content-Length: 0

    ]]>
  </send>

  <recv response="200">
  </recv>

  <!-- Keep the call open for a while in case the 200 is lost to be     -->
  <!-- able to retransmit it if we receive the BYE again.               -->
  <pause milliseconds="500"/>

  <!-- definition of the response time repartition table (unit is ms)   -->
  <ResponseTimeRepartition value="10, 20, 30, 40, 50, 100, 150, 200"/>

  <!-- definition of the call length repartition table (unit is ms)     -->
  <CallLengthRepartition value="10, 50, 100, 500, 1000, 5000, 10000"/>

</scenario>
