<?xml version="1.0" encoding="ISO-8859-1" ?>
<!DOCTYPE scenario SYSTEM "sipp.dtd">

<scenario name="T38 REINVTE">
<send retrans="500">
<![CDATA[

INVITE sip:[service]@[remote_ip]:[remote_port] SIP/2.0
Via: SIP/2.0/UDP [local_ip]:[local_port];branch=[branch]
From: <sip:390415094280@[local_ip]:[local_port]>;tag=[pid]SIPpTag00[call_number]
To: <sip:[service]@[remote_ip]:[remote_port]>
Call-ID: [call_id]
X-VCC-UUID: [pid][clock_tick][call_number]
X-VCC-Provider: 61 [local_ip] BEL
Supported: rel1xx,timer,replaces
Min-SE:  181
User-Agent: Cisco-SIPGateway/IOS-12.x
Allow: INVITE, OPTIONS, BYE, CANCEL, ACK, PRACK, COMET, REFER, SUBSCRIBE, NOTIFY, INFO, UPDATE, REGISTER
CSeq: 101 INVITE
Max-Forwards: 69
Contact: <sip:390415094280@[local_ip]:[local_port]>
Expires: 180
Allow-Events: telephone-event
Content-Type: application/sdp
Content-Length: [len]
      
v=0
o=CiscoSystemsSIP-GW-UserAgent 9624 5279 IN IP4 [local_ip]
s=SIP Call
c=IN IP4 [media_ip]
t=0 0
m=audio 9000 RTP/AVP 0 18 101
c=IN IP[local_ip_type] [local_ip]
a=rtpmap:101 telephone-event/101

]]>
</send>

<recv response="100">
</recv>

<recv response="100" optional="true">
</recv>

<recv response="100" optional="true">
</recv>

<recv response="180" optional="true">
</recv>
<recv response="183" optional="true">
</recv>

<recv response="200" rrs="true">
   <action>
  	<ereg regexp="[[:punct:]](.*)[[:punct:]]" search_in="hdr" header="Contact:" check_it="true" assign_to="6,1" />
    	<ereg regexp=".*" search_in="hdr" header="From:" check_it="true" assign_to="2" />
    	<ereg regexp=".*" search_in="hdr" header="To:" check_it="true" assign_to="3" />
    	<log message="Log to avoid the problem of not using $6 [$6]"/>
   </action>
</recv>

<send>
<![CDATA[

ACK [next_url] SIP/2.0
[routes]
Via: SIP/2.0/UDP [local_ip]:[local_port];branch=[branch]
From: [$2]
To: [$3]
Call-ID: [call_id]
Max-Forwards: 69
CSeq: 101 ACK
Content-Length: [len]

]]>
</send>


<pause milliseconds="2000"/>

<send retrans="500">

<![CDATA[

INVITE [$1] SIP/2.0
Via: SIP/2.0/[transport] [local_ip]:[local_port];branch=[branch]
From: [$2]
To: [$3]
Call-ID: [call_id]
CSeq: 102 INVITE
Contact: <sip:[local_ip]:[local_port]>
Max-Forwards: 70
Content-Type: application/sdp
[routes]
Allow-Events: telephone-event
Content-Length: [len] 

v=0
o=CiscoSystemsSIP-GW-UserAgent 9624 5280 IN IP4 [local_ip]
s=Asterisk PBX 1.6.2.0
c=IN IP[local_ip_type] [local_ip]
t=0 0
m=image 4389 udptl t38
a=T38FaxVersion:0
a=T38MaxBitRate:14400
a=T38FaxRateManagement:transferredTCF
a=T38FaxMaxDatagram:1400
a=T38FaxUdpEC:t38UDPRedundancy

]]>

</send>

<recv response="100" optional="true">
</recv>
  
<recv response="488" rrs="true">
</recv>


<send>
<![CDATA[

ACK [$1] SIP/2.0
Via: SIP/2.0/[transport] [local_ip]:[local_port];branch=[branch]
[last_Call-ID:]
[last_From]
[last_To]
CSeq: 102 ACK
Max-Forwards: 70
[routes]
Content-Length: 0


]]>
</send>

<pause milliseconds="2000"/>

<send retrans="500">

<![CDATA[

INVITE [$1] SIP/2.0
Via: SIP/2.0/[transport] [local_ip]:[local_port];branch=[branch]
[last_Call-ID:]
From: [$2]
To: [$3]
CSeq: 103 INVITE
Contact: <sip:[local_ip]:[local_port]>
Max-Forwards: 70
Content-Type: application/sdp
[routes]
Allow-Events: telephone-event
Content-Length: [len] 

v=0
o=HuaweiSoftX3000 6644052 6644052 IN IP[local_ip_type] [local_ip]
s=Sip Call
c=IN IP[media_ip_type] [media_ip]
t=0 0
m=audio 9000 RTP/AVP 0 18 101
c=IN IP[local_ip_type] [local_ip]
a=rtpmap:101 telephone-event/101


]]>

</send>

<recv response="100" optional="true">
</recv>
  
<recv response="200" rrs="true">
</recv>

<send>
<![CDATA[

ACK [$1] SIP/2.0
Via: SIP/2.0/[transport] [local_ip]:[local_port];branch=[branch]
[last_Call-ID:]
[last_From]
[last_To]
CSeq: 103 ACK
Max-Forwards: 70
[routes]
Content-Length: 0


]]>

</send>

<pause milliseconds="2000" />

<nop>
  <action>
    <exec play_pcap_audio="./tests/fax/pjsip/t38_enabled_two_reinvite_on_a_leg/sipp/CARRIER_G711U.pcap"/>
  </action>
</nop>

<pause milliseconds="20000" />
  
<send retrans="500">
<![CDATA[

BYE [$1] SIP/2.0
Via: SIP/2.0/UDP [local_ip]:[local_port];branch=[branch]
To: [$3]
From: [$2]
[last_Call-ID:]
User-Agent: Cisco-SIPGateway/IOS-12.x
Max-Forwards: 69
CSeq: 104 BYE
Content-Length: 0

]]>
</send>

<recv response="200">
</recv>


</scenario>

